省份,地区,学校名称,类型,电话,邮编,地址
北京,北京市朝阳区,北京市朝阳区安贞街道第一幼儿园,幼儿园,0106441,,北京市朝阳区安贞里三区13号楼
北京,北京市朝阳区,十八里店乡十里河幼儿园,幼儿园,010-67315199,,北京市朝阳区十八里店乡十里河村
北京,北京市朝阳区,朝阳区左家庄幼儿园,幼儿园,010-64648930,,北京市朝阳区左家庄北里31号楼
北京,北京市朝阳区,左家庄中心幼儿园,幼儿园,010-64660909,,北京市朝阳区左家庄三源里街10号楼
北京,北京市朝阳区,鸿运达物业第二幼儿园,幼儿园,010-64172077,,朝阳区幸福三村新东路2号
北京,北京市朝阳区,北京九龙幼儿园,幼儿园,010-67786418,,北京市朝阳区东三环中路18号
北京,北京市朝阳区,邮政管理局金雁幼儿园,幼儿园,,,朝阳区垂杨柳中里14号楼南
北京,北京市朝阳区,北京市朝阳区亚运村中心幼儿园,幼儿园,010-64913596,100029,北京市朝阳区亚运村安苑北里12号楼
北京,北京市朝阳区,北京电子城幼儿园,幼儿园,010-64371741,,北京朝阳区酒仙桥一街坊甲2号
北京,北京市朝阳区,北京小牛津双语幼儿园,幼儿园,010-64895533,,
北京,北京市朝阳区,北京市朝阳区石佛营幼儿园,幼儿园,010-85815083,,北京市朝阳区石佛营西里4号楼
北京,北京市朝阳区,北京星海艺术幼儿园,幼儿园,010-67348744,,朝阳区松榆西里64号
北京,北京市朝阳区,榆东里幼儿园,幼儿园,010-67343168,,朝阳区松榆东里30号楼
北京,北京市朝阳区,管庄建东苑幼儿园,幼儿园,010-65723265,,北京市朝阳区管庄西里20号
北京,北京市朝阳区,北京博凯智能全纳幼儿园,幼儿园,0106492,,北京市朝阳区世纪村西区6号楼
北京,北京市朝阳区,朝阳区花家地北里幼儿园,幼儿园,010-64736605,,北京市朝阳区花家地北里9号楼
北京,北京市朝阳区,天爱双语才艺幼儿园,幼儿园,010-64917722,,北四环东路甘杨树甲16号
北京,北京市朝阳区,北京市朝阳区双叶幼儿园,幼儿园,010-65917457,,北京市朝阳区甜水园东里43号
北京,北京市朝阳区,蒙台梭利国际幼儿园,幼儿园,,,北京市 北京市区 朝阳区 : 朝阳区三里屯北小街7号
北京,北京市朝阳区,启明双语幼儿园,幼儿园,5863203,,北京市朝阳区广渠路28号珠江帝景小区222栋
北京,北京市大兴区,北京市大兴区福苑双语艺术幼儿园,幼儿园,,102600,
北京,北京市大兴区,北京市大兴区小星星双语艺术幼儿园,幼儿园,010-60258754,,
北京,北京市大兴区,北京亦庄小大人艺术幼儿园,幼儿园,5802076,,北京市亦庄小羊坊小康小区小大人艺术幼儿园
北京,北京市大兴区,丑小丫少儿舞蹈,幼儿园,13391811996,,长途汽车站小商品市场南
北京,北京市大兴区,大兴县工业局幼儿园,幼儿园,,102600,北京市大兴县兴政西里
北京,北京市大兴区,大兴县黄村第四幼儿园,幼儿园,,102600,北京市大兴县清源西里
北京,北京市大兴区,大兴县黄村第三幼儿园,幼儿园,,102600,北京市大兴县富强西里
北京,北京市大兴区,大兴县人民政论机关幼儿园,幼儿园,,102600,北京市大兴县林校北里
北京,北京市大兴区,北京市大兴县黄村第二幼儿园,幼儿园,010-69242302,,
北京,北京市东城区,北京市第一幼儿园,幼儿园,010-64041825,100007,东城区东四北大街汪芝麻胡同19号
北京,北京市东城区,北京市一幼附属实验园,幼儿园,8427571,,安定门外小黄庄小区7号楼
北京,北京市东城区,北京市东城区卫生局第三幼儿园,幼儿园,6524518,,北京站西侧东镇江胡同2号
北京,北京市东城区,北京市第二幼儿园,幼儿园,6525572,100007,王府井大街甘雨胡同36号
北京,北京市东城区,北京东四五条幼儿园,幼儿园,6401489,,东四五条胡同41号
北京,北京市东城区,北京东华门幼儿园,幼儿园,6512434,,东华门北河沿大街149号
北京,北京市东城区,北京分司厅幼儿园,幼儿园,8402462,,安定门内分司厅胡同57号
北京,北京市东城区,北京东棉花幼儿园,幼儿园,6404414,,交道口南大街东棉花胡同20号
北京,北京市东城区,北京大方家幼儿园,幼儿园,6513700,,朝阳门内大方家胡同35号
北京,北京市东城区,北京东城职教中心附属园,幼儿园,6416887,,东直门外十字坡22号
北京,北京市东城区,北京新中街幼儿园,幼儿园,6460214,,东直门外胡家园小区24号楼
北京,北京市东城区,北京雍和宫幼儿园,幼儿园,6403505,,藏经馆胡同27号
北京,北京市东城区,北京市东城区华丰幼儿园,幼儿园,8422909,,和平里六区21号楼
北京,北京市东城区,崇文区第二幼儿园,幼儿园,6714285,,安化北里64号园长:何佩云
北京,北京市东城区,北京市崇文区第二幼儿园,幼儿园,,100062,北京市崇文区安化北里64号
北京,北京市东城区,崇文区北京军区空军蓝天育翔幼儿园,幼儿园,66911844,,北京市崇文区板厂南里11号
北京,北京市东城区,北京市崇文区前门幼儿园,幼儿园,67014817,100051,崇文区西兴隆街135号
北京,北京市东城区,中国人民解放军北京军区空军育翔幼儿园,幼儿园,6691184,100061,北京市崇文区板桥南里11号北空育翔幼儿园
北京,北京市东城区,北京市崇文区第三幼儿园,幼儿园,6701562,100061,北京市崇文区幸福北里12楼对面崇文区第三幼儿园
北京,北京市东城区,北京市崇文区光明幼儿园,幼儿园,6712976,,崇文区光明25楼园长:郝杰兰
北京,北京市东城区,武警北京总队幼儿园,幼儿园,6524197,,崇文门内苏州胡同74号
北京,北京市东城区,北京市第三幼儿园,幼儿园,6605543,,中山公园内
北京,北京市东城区,北京东城区回民幼儿园,幼儿园,6525095,,朝阳门内小牌坊胡同16号
北京,北京市东城区,东城区卫生局第一幼儿园,幼儿园,6525197,,王府井大街锡拉胡同
北京,北京市东城区,新闻出版署幼儿园,幼儿园,6400210,,东四十条113号
北京,北京市东城区,总参军训部幼儿园,幼儿园,6679820,,朝阳门内仓南胡同5号
北京,北京市东城区,民航总局机关幼儿园,幼儿园,6401488,,地安门拐捧胡同2号
北京,北京市东城区,财政部幼儿园,幼儿园,6401836,,大佛寺刚察胡同8号
北京,北京市东城区,空后蓝天幼儿园,幼儿园,6672522,,鼓楼东大街北锣鼓巷99号
北京,北京市东城区,鸿运达客一幼儿园,幼儿园,6236023,,就鼓楼外街64号
北京,北京市东城区,北京军区总医院幼儿园,幼儿园,6400773,,东直门北小街草原胡同58号
北京,北京市东城区,北京自来水集团公司幼儿园,幼儿园,6465157,,东直门外北大街甲4号
北京,北京市东城区,国家煤炭局幼儿园,幼儿园,6426172,,和平里九区甲3号
北京,北京市东城区,国家林业局幼儿园,幼儿园,6421275,,和平里七区甲21号楼
北京,北京市东城区,化学工业部幼儿园,幼儿园,6421289,,和平里化工部院内
北京,北京市东城区,交通部机关幼儿园,幼儿园,6421257,,安华西里三区18号楼
北京,北京市东城区,和平里一区幼儿园,幼儿园,8422201,,和平里一区甲4号院
北京,北京市东城区,柏林寺托儿所,幼儿园,6421504,,和平里南口民旺一区甲18号
北京,北京市东城区,北新幼儿园（好像已经关闭了）,幼儿园,6404028,,北新桥北新胡同三巷3号
北京,北京市东城区,北京西羊管幼儿园,幼儿园,6404584,,西羊管胡同3号
北京,北京市东城区,北京西仓门幼儿园,幼儿园,6404404,,西仓门胡同2号
北京,北京市东城区,十四条回民幼儿园,幼儿园,6404561,,十四条胡同7号
北京,北京市东城区,北京赵堂子幼儿园,幼儿园,6525234,,赵堂子胡同11号
北京,北京市东城区,北京黄化门幼儿园,幼儿园,6404451,,黄化门大街8号
北京,北京市东城区,北京魏家幼儿园,幼儿园,6404040,,魏家胡同19号
北京,北京市东城区,北京锻库幼儿园,幼儿园,6525207,,锻库胡同18号
北京,北京市东城区,北京大经厂幼儿园,幼儿园,010-64045445,100009,东城区大经厂胡同55号
北京,北京市东城区,史家胡同幼儿园,幼儿园,6525005,,史家胡同24号
北京,北京市东城区,北京兴华幼儿园,幼儿园,4032157,,后鼓楼苑36号
北京,北京市东城区,小方家幼儿园,幼儿园,,100010,
北京,北京市东城区,西镇江托儿所,幼儿园,6524541,100005,北京市东城区西镇江胡同25号
北京,北京市东城区,北京市东城区府学胡同幼儿园,幼儿园,6404145,,
北京,北京市东城区,北京市东城区东直门幼儿园,幼儿园,6465157,,
北京,北京市东城区,北京市东城区卫生局第一幼儿园,幼儿园,010-65251975,100006,北京市东城区锡拉胡同19号
北京,北京市东城区,民用航空总局机关幼儿园,幼儿园,6401488 3640747,100009,北京市东城区地安门拐棒胡同2号
北京,北京市东城区,北京市大方家幼儿园,幼儿园,,100010,北京市东城区大方家胡同35号
北京,北京市东城区,北京市东城区北新桥街道二条幼儿园,幼儿园,,100007,北京市东城区北新桥头条22号
北京,北京市东城区,北京市东城区北新桥西羊管幼儿园,幼儿园,,100007,北京市东城区东内西羊管胡同3号
北京,北京市东城区,北京东四八条幼儿园,幼儿园,,100007,北京市东城区东四八条111号
北京,北京市东城区,北京市东城区顺城回民幼儿园,幼儿园,,100010,北京市东城区东四北顺城南沟沿11号
北京,北京市东城区,北京市崇文区安乐幼儿园,幼儿园,6721286,,永外杨家园路10号
北京,北京市东城区,北京打磨厂幼儿园,幼儿园,7020244,,西打磨厂37号
北京,北京市东城区,崇文区永内幼儿园,幼儿园,7025985,,永内东坛根54号后院
北京,北京市东城区,红湖幼儿园,幼儿园,6712302,,龙潭北里三条
北京,北京市东城区,崇文区东市场幼儿园,幼儿园,6702414,,天桥东市场七巷9号
北京,北京市东城区,崇文区西草市幼儿园,幼儿园,,100050,崇文区西草市东街60号
北京,北京市东城区,崇文区东晓市幼儿园,幼儿园,6702335,100062,东晓市大街201号
北京,北京市东城区,北空蓝天育翔幼儿园,幼儿园,6691184,100061,板厂南里11号
北京,北京市东城区,北京铁路生活服务中心永定门幼儿园,幼儿园,5183781,,永定门车站路12号
北京,北京市东城区,天坛公园幼儿园,幼儿园,6702886,,天坛公园西门内
北京,北京市东城区,北京铁路生活服务中心夕照寺幼儿园,幼儿园,6712138,,夕照寺东里20号
北京,北京市东城区,北京崇文区珐琅厂幼儿园,幼儿园,8728115,,永外安乐林路10号
北京,北京市东城区,崇文托儿所分所,幼儿园,6702597,,天坛东侧路南区79号
北京,北京市东城区,鸿运达第五幼儿园,幼儿园,6705638,,永外东街中里7号
北京,北京市东城区,崇文区第三幼儿园,幼儿园,,,幸福北里12楼对面
北京,北京市东城区,北京专业壁画公司,幼儿园,010-81615300 13391709363,,
北京,北京市东城区,北京市崇文区饭食公司幼儿园,幼儿园,,100050,北京市崇文区天桥东市场六巷2号
北京,北京市东城区,北京铁路分局北京生活段永定门幼儿园,幼儿园,,100054,北京市崇文区车站路12号
北京,北京市东城区,北京铁路分局北京生活段夕照寺幼儿园,幼儿园,,100061,北京市崇文区夕照寺东里20号
北京,北京市东城区,北京市崇文区西草市幼儿园,幼儿园,,100050,北京市崇文区西草市东街60号
北京,北京市东城区,北京市崇文区东市场幼儿园,幼儿园,,100050,北京市崇文区9号
北京,北京市东城区,北京市崇文区辰光幼儿园,幼儿园,,100051,北京市崇文区大江胡同46号
北京,北京市东城区,崇文区东小市幼儿园,幼儿园,,100062,北京市崇文区东晓市大街201号
北京,北京市东城区,北京市崇文区永内幼儿园,幼儿园,,100050,北京市崇文区54号
北京,北京市东城区,北京市崇文区幼儿教育研究中心,幼儿园,,100061,北京市崇文区广渠门夕照寺三号
北京,北京市东城区,北京市崇文区回民幼儿园,幼儿园,,100062,北京市崇文区东花市东区12楼
北京,北京市东城区,北京市崇文区东柳树井幼儿园,幼儿园,,100062,北京市崇文区珠市口东大街66号
北京,北京市东城区,幸福幼儿园,幼儿园,,100061,北京市崇文区龙潭
北京,北京市东城区,北京市崇文区永东幼儿园,幼儿园,,100050,北京市崇文区永内东街中里23号
北京,北京市东城区,北京市崇文区实验幼儿园,幼儿园,,100062,北京市崇文区前门奋章胡同53号
北京,北京市东城区,北京市东城区北新桥西仓门幼儿园,幼儿园,,100007,北京市东城区八宝坑24号
北京,北京市东城区,北京市东城区景山三眼井幼儿园,幼儿园,,100009,北京市东城区三眼井胡同29号
北京,北京市东城区,中国中医研究院行政处幼儿园,幼儿园,,100700,北京市东城区北新仓18号
北京,北京市东城区,北京市东城区安定门钟楼湾幼儿园,幼儿园,,100009,北京市东城区安定门钟楼湾11号
北京,北京市东城区,北京市东城区交道口兴华幼儿园,幼儿园,,100009,北京市东城区后鼓楼苑36号
北京,北京市东城区,北京市东城区东直门街道新兴里幼儿园,幼儿园,,100027,北京市东城区东外新兴里19号楼
北京,北京市东城区,人学工业部幼儿园,幼儿园,,100013,北京市东城区和平里化工大院
北京,北京市东城区,北京市东城区北新桥北新幼儿园,幼儿园,,100007,北京市东城区北新胡同三巷3号
北京,北京市东城区,东城区交道口雨儿幼儿园,幼儿园,,100009,北京市东城区雨儿胡同乙15号
北京,北京市东城区,北京市东城区景山魏家幼儿园,幼儿园,,100007,北京市东城区魏家胡同19号
北京,北京市东城区,北京市东城区景山黄化门幼儿园,幼儿园,,100009,北京市东城区黄化门大街8号
北京,北京市东城区,北京市王府大街幼儿园,幼儿园,,100010,北京市东城区大勃鸽胡同14号
北京,北京市东城区,北京市新中街幼儿园,幼儿园,,100027,北京市东城区东外胡家园小区24楼
北京,北京市东城区,北京市东城区人民政府机关幼儿园,幼儿园,,100010,北京市东城区朝阳门本司胡同7号
北京,北京市东城区,北京市东城区回民幼儿园,幼儿园,,100010,北京市东城区南小街小牌仿胡同16号
北京,北京市东城区,北京东城区朝阳门街道史家幼儿园,幼儿园,,100010,北京市东城区史家胡同24号
北京,北京市东城区,新闻出版署培新幼儿园,幼儿园,,100007,北京市东城区东四十条113号
北京,北京市东城区,最高法院机关幼儿园,幼儿园,,100745,北京市东城区东交民巷27号
北京,北京市东城区,北京东城东华门缎库幼儿园,幼儿园,,100006,北京市东城区东华门缎库胡同18号
北京,北京市东城区,北京市东棉花幼儿园,幼儿园,,100009,北京市东城区东棉花胡同甲20号
北京,北京市东城区,北京市分司厅幼儿园,幼儿园,,100009,北京市东城区分司厅胡同57号
北京,北京市东城区,北京市雍和宫幼儿园,幼儿园,,100007,北京市东城区藏经馆27号
北京,北京市东城区,北京市府学胡同幼儿园,幼儿园,,100007,北京市东城区府学胡同61号
北京,北京市东城区,卫生局第二幼儿园,幼儿园,,100007,北京市东城区东四六条甲62号
北京,北京市东城区,六一幼儿园,幼儿园,,100091,北京市海淀区六间房1号
北京,北京市东城区,第一幼儿园,幼儿园,,100007,北京市东城区汪芝麻胡同19号
北京,北京市东城区,团结湖第一幼儿园,幼儿园,,100026,北京市朝阳区团结湖北头条11楼
北京,北京市东城区,东城区分司厅幼儿园,幼儿园,010-64046854,,北京市分司厅胡同57号
北京,北京市东城区,东城区北京市第七幼儿园,幼儿园,010-64008955,,北京市东城区宝钞胡同23号
北京,北京市东城区,东城 新中街幼儿园,幼儿园,010-64682760,,北京东城区胡家园小区24号楼
北京,北京市东城区,东城区 冶金幼儿园,幼儿园,010-83276010,,北京市东城区安外安德路47号冶金幼儿园
北京,北京市东城区,果子市幼儿园,幼儿园,6404016,,鼓楼西大街169号园长:杨小平
北京,北京市东城区,东城区东华门幼儿园,幼儿园,6512434,,西河尚大街149号园长:连玉华
北京,北京市东城区,煤炭工业部机关幼儿园,幼儿园,6421776 25900,,东城和平进而九区3号园长:杨春凤
北京,北京市东城区,中国民用航空总局机关幼儿园,幼儿园,6401488,,地安门拐捧胡同2号园长:陈穗军
北京,北京市东城区,中国人民解放军总政治部幼儿园,幼儿园,6679477 6679477,,安德里北街27号园长:刘九如
北京,北京市东城区,中国人民解放军空军后勤部幼儿园,幼儿园,6672524,,东城区北锣鼓巷99号园长:鲁惠玉
北京,北京市东城区,东城区东四五条幼儿园,幼儿园,6404019,,东四五条41号园长:王小萍
北京,北京市东城区,自来水公司东直门幼儿园,幼儿园,6465157,,东城区东直门北大街甲4号园长:段莹
北京,北京市东城区,林业部幼儿园,幼儿园,6421275 4420810,,东城区和平里七区21号楼园长:唐静风
北京,北京市房山区,房山服装一厂幼儿园,幼儿园,8932855,,房山服装一厂
北京,北京市房山区,北京化工四厂幼儿园,幼儿园,6931355,,北京化工四厂
北京,北京市房山区,北京煤矿机械厂幼儿园,幼儿园,6931320,,北京煤矿机械厂
北京,北京市房山区,北京输油公司幼儿园,幼儿园,6931385,,输油公司
北京,北京市房山区,北京电业幼儿园,幼儿园,6935205,,繁华巷5号
北京,北京市房山区,北京火电建设公司幼儿园,幼儿园,8935336,,北京火电建设公司
北京,北京市房山区,房山区长阳镇中心幼儿园,幼儿园,8035105,,长阳镇长阳村
北京,北京市房山区,房山区坨里镇中心幼儿园,幼儿园,8037624,,；坨里镇坨里村
北京,北京市房山区,房山刘李店幼儿园,幼儿园,010-61393129,,
北京,北京市房山区,房山街道幼儿园,幼儿园,,102400,北京市房山区南关
北京,北京市房山区,燕山幼儿园,幼儿园,,102500,北京市房山区杏花西里
北京,北京市房山区,良乡幼儿园,幼儿园,,102401,北京市房山区三街
北京,北京市房山区,天之骄子智能开发幼儿园,幼儿园,010-69315588 69316688,,房山区城关西大街8号天之骄子智能开发幼儿园
北京,北京市丰台区,芳庄一幼,幼儿园,6762811,,方庄小区芳古园一区16楼
北京,北京市丰台区,芳庄二幼,幼儿园,6763527,,方庄小区芳星园三区22楼
北京,北京市丰台区,芳庄三幼及分园,幼儿园,6764468 6762102,,方庄小区芳城园一区8楼-方庄小区芳城园一区7楼
北京,北京市丰台区,蒲黄榆二幼,幼儿园,6763544,,丰台区蒲安里8号楼
北京,北京市丰台区,青塔幼儿园,幼儿园,6867743,,丰台区青塔小区蔚园15号
北京,北京市丰台区,嘉园一幼,幼儿园,6753280,,丰台区嘉园二里13号楼
北京,北京市丰台区,长辛店一幼,幼儿园,8387668,,丰台区长辛店大寺口20号
北京,北京市丰台区,丰教工托儿所,幼儿园,6382159,,丰台区子阳小区
北京,北京市丰台区,南苑教工幼儿园,幼儿园,6799175,,南苑东长安街12号
北京,北京市丰台区,大红门东楼幼儿园,幼儿园,6722195,100075,丰台区大红门
北京,北京市丰台区,江佳实验园,幼儿园,6769753,,分庄芳古园二区6号
北京,北京市丰台区,阳光双语幼儿园,幼儿园,8725997,,石榴庄北里24号
北京,北京市丰台区,高娃纲琴幼儿园,幼儿园,6867170,,丰台区小石路6号
北京,北京市丰台区,怡海幼儿园,幼儿园,6374322,100070,丰台怡海花园内
北京,北京市丰台区,北分之星幼儿园,幼儿园,6305327,,玉林小区东里一区5楼
北京,北京市丰台区,正阳幼儿园,幼儿园,6371849,,丰台桥南正阳头条5号
北京,北京市丰台区,兴隆幼儿园,幼儿园,6281179,,丰台北大地二里平房
北京,北京市丰台区,胜利幼儿园,幼儿园,6373843,,丰台桥南东兴里118号
北京,北京市丰台区,芳群二幼,幼儿园,6760946,,方庄小区芳群四区10号
北京,北京市丰台区,芳群二幼（分园）,幼儿园,6762978,,方庄小区芳群园二区18号
北京,北京市丰台区,长辛店大街幼儿园,幼儿园,8387629,,长辛店大街100号
北京,北京市丰台区,五里店幼儿园,幼儿园,6381768,100071,丰台五里店小区17号
北京,北京市丰台区,卢沟桥街道二幼,幼儿园,6867145,,青塔小区蔚园15楼北
北京,北京市丰台区,孟村幼儿园,幼儿园,6373458,,丰台区孟村120号
北京,北京市丰台区,新干路幼儿园,幼儿园,6799130,,南苑新干路头道街
北京,北京市丰台区,丰台区政府幼儿园,幼儿园,6381181,,
北京,北京市丰台区,丰台区卫生局幼儿园,幼儿园,6762883,,分庄芳星园三区28号
北京,北京市丰台区,分院幼儿园,幼儿园,6838186,,东高地万源东里90栋
北京,北京市丰台区,三院幼儿园,幼儿园,6837626,,台区云岗东里18号
北京,北京市丰台区,七O一所幼儿园,幼儿园,6837554,,云岗东里8号楼
北京,北京市丰台区,三十一所幼儿园,幼儿园,6837599,,云岗北区东里8号
北京,北京市丰台区,苏星园一幼,幼儿园,6763829,,苏星园二区16号楼
北京,北京市丰台区,201所幼儿园,幼儿园,8386668,,丰台区槐树岭4号
北京,北京市丰台区,首都机械厂幼儿园,幼儿园,6875144,,东高地斜街16号
北京,北京市丰台区,丰台铁路幼儿园,幼儿园,6325183,,丰台桥南韩庄子东里
北京,北京市丰台区,宛平幼儿园,幼儿园,8321474,100072,丰台区晓日苑垂虹街
北京,北京市丰台区,二七车辆厂幼儿园,幼儿园,8387772,,长辛店张郭庄甲1号
北京,北京市丰台区,北分车辆厂幼儿园,幼儿园,8380720,,丰台区米家坟
北京,北京市丰台区,欣宇幼儿园,幼儿园,6756327,,西马场北里15号
北京,北京市丰台区,环球橡胶厂幼儿园,幼儿园,6724763,,永孙海慧寺1号
北京,北京市丰台区,微电机厂幼儿园,幼儿园,6353861,,右孙东二条33号
北京,北京市丰台区,桥果厂幼儿园,幼儿园,6371756,,丰台区葛村51号
北京,北京市丰台区,地铁车辆厂幼儿园,幼儿园,6762113,,永孙宋家庄苇子坑23号
北京,北京市丰台区,红分市幼儿园,幼儿园,6762259,,永外顺回条24号
北京,北京市丰台区,邮局三年慧寺幼儿园,幼儿园,6723355,,永外南项村44楼
北京,北京市丰台区,建村北工厂幼儿园,幼儿园,8386540,,丰台区大灰厂81号
北京,北京市丰台区,北玛建筑厂幼儿园,幼儿园,6353729,,右孙西庄新村西五巷
北京,北京市丰台区,第三热电厂托儿所,幼儿园,8331113,,云岗南区38楼西
北京,北京市丰台区,耐火材料厂幼儿园,幼儿园,8329199,,小郭庄西路36号
北京,北京市丰台区,南厢物资托儿所,幼儿园,6767292,,永外顺6条9号
北京,北京市丰台区,2301部队幼儿园,幼儿园,6687346,,东安街头条19号
北京,北京市丰台区,装工院幼儿园,幼儿园,6671747,,长辛店杜家坎19号
北京,北京市丰台区,66040部队幼儿园,幼儿园,6671501,,东大街七里店路49号
北京,北京市丰台区,空一所幼儿园,幼儿园,6671335,,南苑机场203信箱
北京,北京市丰台区,空没局幼儿园,幼儿园,6671106,,丰台区洋桥12号
北京,北京市丰台区,海航幼儿园,幼儿园,6695927,,丰台东大街5号院
北京,北京市丰台区,51所幼儿园,幼儿园,6686104,,北京7227信箱
北京,北京市丰台区,302医院幼儿园,幼儿园,6693304,,丰台路26号
北京,北京市丰台区,95810部队幼儿园,幼儿园,6691502,,丰台区南苑机场内
北京,北京市丰台区,83963部队幼儿园,幼儿园,6686219,,长辛店槐树岭3号
北京,北京市丰台区,62030部队幼儿园,幼儿园,6694894,,丰台东大街20号
北京,北京市丰台区,红狮幼儿园,幼儿园,,,北京市 北京市区 丰台区 : 丰台区东铁营顺四条24号
北京,北京市丰台区,鹤立实验幼儿园,幼儿园,,,北京市 北京市区 丰台区 : 丰台区芳古园一区11号
北京,北京市丰台区,北京阳光双语艺术幼儿园,幼儿园,8725998 1872599,100079,北京丰台区石榴园北里小区24号阳光双语艺术幼儿园
北京,北京市丰台区,北京铁路分局北京生活段丰西幼儿园,幼儿园,,100071,北京市丰台区丰西北里93号
北京,北京市丰台区,北京市丰台区五爱屯幼儿园,幼儿园,,100076,北京市丰台区五爱屯街11号
北京,北京市丰台区,北京市丰台区右安门办事处三八幼儿园,幼儿园,,100054,北京市丰台区东3条五楼12号
北京,北京市丰台区,机械电子工业部第201研究所前进幼儿园,幼儿园,,100072,北京市丰台区槐树岭4号院
北京,北京市丰台区,北京市丰台区南苑教工幼儿园,幼儿园,,100076,北京市丰台区东长街12号
北京,北京市丰台区,方庄办事处第一幼儿园,幼儿园,,100078,北京市丰台区芳群园二区18号楼
北京,北京市丰台区,北京市丰台区芳古园幼儿园,幼儿园,,100078,北京市丰台区芳古园一区十六楼
