省份,地区,学校名称,类型,电话,邮编,地址
北京,北京市丰台区,北京铁路分局北京生活段丰台第三幼儿园,幼儿园,,100071,北京市丰台区韩庄子东里1号
北京,北京市丰台区,航天工业总公司三院幼儿园,幼儿园,,100074,北京市丰台区南区东里18号
北京,北京市丰台区,北京市丰台区方庄第四幼儿园,幼儿园,,100078,北京市丰台区芳古园二区6#楼
北京,北京市丰台区,方庄办事处芳群第二幼儿园,幼儿园,,100078,北京市丰台区芳群园四区10号楼
北京,北京市丰台区,北京市丰台区群英幼儿园,幼儿园,,100077,北京市丰台区西罗园三区十号楼
北京,北京市丰台区,北京市丰台区育英幼儿园,幼儿园,,100077,北京市丰台区九区33号
北京,北京市丰台区,北京市丰台区太平桥东里幼儿园,幼儿园,,100073,北京市丰台区太平桥东里20号院
北京,北京市丰台区,北京市丰台区青塔幼儿园,幼儿园,,100039,北京市丰台区蔚园15号
北京,北京市丰台区,北京市丰台区东罗园幼儿园,幼儿园,,100075,北京市丰台区小区1号楼
北京,北京市丰台区,北京市丰台区樊家村教工幼儿园,幼儿园,,100071,北京市丰台区樊家村56号
北京,北京市丰台区,北京市丰台区人民政府机关幼儿园,幼儿园,,100071,北京市丰台区北大街1号
北京,北京市丰台区,北京市丰台区实验幼儿园,幼儿园,,100078,北京市丰台区芳群园二区10楼
北京,北京市丰台区,方庄第一幼儿园,幼儿园,,100076,北京市丰台区丰台区芳古园一区方庄第一幼儿园
北京,北京市丰台区,北京市丰台区丰台第一幼儿园,幼儿园,,100071,北京市丰台区东大街28号
北京,北京市丰台区,丰台第一幼儿园,幼儿园,63811373,,北京市丰台区东大街乙８号
北京,北京市丰台区,北京市丰台区方庄第一幼儿园,幼儿园,010-67628116,,北京市丰台区方庄芳古园一区16号
北京,北京市丰台区,丰台区方庄鹤立实验幼儿园,幼儿园,010-67603610,,丰台区方庄芳古园一区11号
北京,北京市丰台区,丰台区政府机关幼儿园,幼儿园,010-83656448,,北京市丰台区北大街1号
北京,北京市丰台区,北京市丰台区蒲黄榆第二幼儿园,幼儿园,6762234,,丰台区蒲黄榆蒲安里8号楼园长:李淑清
北京,北京市丰台区,丰台第三幼儿园,幼儿园,63815572,,丰台区五里店园长:大晓红
北京,北京市丰台区,北京市丰台区丰台第四幼儿园,幼儿园,6372639,,丰台区桥南造甲南里17号园长:权明
北京,北京市丰台区,丰台区丰台第一幼儿园,幼儿园,6381137,,丰台区东大街28号
北京,北京市丰台区,丰台区方庄第三幼儿园,幼儿园,6764468,,芳城区一区8号楼园长:马淑英
北京,北京市海淀区,63921部队幼儿园,幼儿园,,,海淀永丰乡辛店一号院18号
北京,北京市海淀区,第二炮兵机关一幼,幼儿园,6633652,,海淀清河小营
北京,北京市海淀区,空研大院蓝天幼儿园,幼儿园,6691913,,海淀西三旗空研大院
北京,北京市海淀区,解放军9511工厂幼儿园,幼儿园,8292933,,海淀西三旗2867信箱
北京,北京市海淀区,61886部队幼儿园,幼儿园,6632208,,海淀清河上地
北京,北京市海淀区,总参装备部后勤小营幼儿园,幼儿园,6636750,,北京2873信箱
北京,北京市海淀区,解放军466医院幼儿园,幼儿园,6841222,,海淀466医院
北京,北京市海淀区,武警总部机关幼儿园,幼儿园,6879446,,海淀万泉庄小区16号楼
北京,北京市海淀区,军乐团幼儿园,幼儿园,6686307,,海淀车道沟8号
北京,北京市海淀区,空军指挥学院幼儿园,幼儿园,6692324,,蓝靛厂西门1号
北京,北京市海淀区,95968部队幼儿园,幼儿园,6692047,,昆明湖南路西郊机场
北京,北京市海淀区,总参管理局幼儿园,幼儿园,6678027,,新外大街23号
北京,北京市海淀区,小天使美语幼儿园,幼儿园,6871231,,车道沟南里小区
北京,北京市海淀区,北京六一幼儿院,幼儿园,6288188,,
北京,北京市海淀区,北京明天幼稚集团,幼儿园,62015253,,
北京,北京市海淀区,北京恩济里幼儿园,幼儿园,8813248,,北京市海淀区恩济里小区10号
北京,北京市海淀区,北京立新学校幼儿园,幼儿园,6831191,,阜成路甲3号
北京,北京市海淀区,海淀南路幼儿园,幼儿园,6264581,,海淀南路
北京,北京市海淀区,人民大学附属幼儿园,幼儿园,6251139,,中关村大街59号
北京,北京市海淀区,轮胎有限责任公司幼儿园,幼儿园,8292511,,海淀建材城西路9号.
北京,北京市海淀区,冶金研究院幼儿园,幼儿园,6294951,,清河小营
北京,北京市海淀区,行星减速机厂幼儿园,幼儿园,8291355,,西三旗东厂内
北京,北京市海淀区,北京制呢厂幼儿园,幼儿园,6291329,,清河镇安宁庄
北京,北京市海淀区,林科院幼儿园,幼儿园,6288938,,海淀厢红旗林科院
北京,北京市海淀区,北京分析仪器厂幼儿园,幼儿园,6245777,,海淀温泉北分厂
北京,北京市海淀区,现代艺术幼儿园,幼儿园,8207701,,罗庄西里7号楼
北京,北京市海淀区,国管局幼儿园],幼儿园,010-68429816,100037,海淀区增光路51号
北京,北京市海淀区,空军直属机关蓝天幼儿园,幼儿园,6698475,,
北京,北京市海淀区,北京军区炮兵幼儿园,幼儿园,,,香山南路红旗村4号
北京,北京市海淀区,总参测绘局幼儿园,幼儿园,6674819,,北三环中路69号
北京,北京市海淀区,北极寺幼儿园,幼儿园,6679609,,海淀花园东路8号
北京,北京市海淀区,总参兵种部第四幼儿园,幼儿园,6674847,,海淀花园北路35号
北京,北京市海淀区,紫竹院二幼,幼儿园,6842067,,魏公村小区16楼西侧
北京,北京市海淀区,展春园幼儿园,幼儿园,6232151,,展春园小区20号
北京,北京市海淀区,羊坊店一幼,幼儿园,6396560,,铁道部宿舍103栋
北京,北京市海淀区,羊坊店二幼,幼儿园,6851670,,茂林居6号
北京,北京市海淀区,培新幼儿园,幼儿园,6256293,,海淀南路22号
北京,北京市海淀区,厂洼幼儿园,幼儿园,6841726,,厂洼小区5号楼西侧
北京,北京市海淀区,北京大学幼儿园,幼儿园,6275156 6275308 6275156,,
北京,北京市海淀区,清华洁华幼儿园,幼儿园,6278235,,
北京,北京市海淀区,海淀区政府机关幼儿园,幼儿园,6255968,,海淀知春东里14号楼
北京,北京市海淀区,中国科学院第一幼儿园（科学院一幼）,幼儿园,6255362,,中关村24号楼旁
北京,北京市海淀区,科学院三幼,幼儿园,6255220,,中关村南一街2号
北京,北京市海淀区,科星幼儿园,幼儿园,6261054,,中关村920楼西侧
北京,北京市海淀区,中关村一幼,幼儿园,6253162,,中关村北一条甲13楼一层
北京,北京市海淀区,育新实验幼儿园,幼儿园,8290630,,育新花园22号楼
北京,北京市海淀区,体育大学幼儿园,幼儿园,6298932,,体育大学
北京,北京市海淀区,501设计部幼儿园,幼儿园,6256238,,海淀知春路82号院
北京,北京市海淀区,清河毛纺织厂幼儿园,幼儿园,6294916,,清河镇毛纺路
北京,北京市海淀区,北毛集团幼儿园,幼儿园,010-62939802,,清河镇北毛厂内
北京,北京市海淀区,小星星双语艺术幼儿园,幼儿园,6289655,,马连洼梅园小区
北京,北京市海淀区,农大西区幼儿园,幼儿园,6273302,100094,北京市海淀区圆明园西路 3 号院
北京,北京市海淀区,电力科学研究院幼儿园,幼儿园,6291320,,清河小营东路7号
北京,北京市海淀区,中国兵器机关幼儿园,幼儿园,6896464,,车道沟十号院
北京,北京市海淀区,北京红旗幼儿园,幼儿园,6224139,,北太平庄红旗南村3号
北京,北京市海淀区,蓟门里幼儿园,幼儿园,6201922,,海淀蓟门里小区
北京,北京市海淀区,冶金建筑总院幼儿园,幼儿园,6222559,,西土城路33号
北京,北京市海淀区,头堆幼儿园,幼儿园,6218083,,北下关头堆村5号
北京,北京市海淀区,航测幼儿园,幼儿园,8232903,,学院路31号
北京,北京市海淀区,铁研幼儿园,幼儿园,6184947,,海淀大柳树路2号
北京,北京市海淀区,北方交通大学幼儿园,幼儿园,5184019,,西直门外上园村3号
北京,北京市海淀区,林业大学幼儿园,幼儿园,6233839,,清华东路35号
北京,北京市海淀区,石勘院幼儿园,幼儿园,6209734,,学院路石油大院内
北京,北京市海淀区,北京科技大学幼儿园,幼儿园,6233285,,学院路30号
北京,北京市海淀区,中国农业大学东区幼儿园,幼儿园,6233698,,
北京,北京市海淀区,北医大幼儿园,幼儿园,6209133,,学院路38号
北京,北京市海淀区,北航幼儿园,幼儿园,8231716,,学院路37号
北京,北京市海淀区,地矿部幼儿园,幼儿园,8232633,,学院路29号
北京,北京市海淀区,北京十五所幼儿园,幼儿园,6232766,,卧虎桥甲6号25分箱
北京,北京市海淀区,北京语言文化大学幼儿园,幼儿园,8230356,,学院路15号
北京,北京市海淀区,石科院祥普公司幼儿园,幼儿园,6231447,,学院路18号
北京,北京市海淀区,公安部一所幼儿园,幼儿园,8851307,,首体南路1号
北京,北京市海淀区,北京六郎庄幼儿园,幼儿园,6264970,,海淀乡六郎庄园子里25号
北京,北京市海淀区,玉渊潭中心幼儿园,幼儿园,8813084,,八里庄174号
北京,北京市海淀区,外文局幼儿园,幼儿园,6841480,,
北京,北京市海淀区,北京燕郊幼儿园,幼儿园,6837230,,阜成路8号
北京,北京市海淀区,中国工商银行幼儿园,幼儿园,8812598,,万寿路八宝庄252号
北京,北京市海淀区,首都师范大学幼教中心,幼儿园,6890255,,
北京,北京市海淀区,北京铁路局幼儿园,幼儿园,5182256,,羊坊店双贝子坟3号
北京,北京市海淀区,未来之星幼儿园,幼儿园,6232880,,学院路
北京,北京市海淀区,北京英才幼儿园,幼儿园,6232414,,北京市海淀区北四环中路志新村小区12号
北京,北京市海淀区,北京岭南幼儿园,幼儿园,8812210,,定慧东里34号
北京,北京市海淀区,北京市私立繁星实验幼儿园,幼儿园,6294876 6295110,,
北京,北京市海淀区,北京阳光早教中心,幼儿园,6825794,,翠微路翠微北里10号楼
北京,北京市海淀区,翠微幼儿园,幼儿园,6822592,,翠微南里小区22号
北京,北京市海淀区,中国机电集团第二研究院中心幼儿园,幼儿园,6838523,,永定路正大南路6号
北京,北京市海淀区,北京青龙桥幼儿园,幼儿园,6288301,,
北京,北京市海淀区,北安河乡中心幼儿园,幼儿园,6245550,,海淀区北安河乡
北京,北京市海淀区,育龙幼儿园,幼儿园,6234584,,清华东路东王庄小区7号
北京,北京市海淀区,北京翠湖幼儿园,幼儿园,6247140,,海淀区上庄乡
北京,北京市海淀区,北京21世纪实验幼儿园恩济一园,幼儿园,8812589 8811595,,海淀恩济庄46号
北京,北京市海淀区,北京21世纪实验幼儿园恩济二园,幼儿园,010-88125026 010-88115050,,"北京西三环航天桥往西定慧寺路口北转500米,21世纪实验学校内"
北京,北京市海淀区,北京市21世纪实验幼儿园玉阜园,幼儿园,8826223 2882649 4786771,,海淀区玉泉路6号院玉阜嘉园内
北京,北京市海淀区,北京21世纪实验幼儿园玉海园,幼儿园,8826223 2010-8826220,,北京市海淀区玉海园一里19号
北京,北京市海淀区,宜宝国际教育,幼儿园,8196571,,北京市海淀区清河永泰园新地标小区甲17
北京,北京市海淀区,中美宜宝幼儿园,幼儿园,8196571,,
北京,北京市海淀区,中国科学院幼儿园,幼儿园,,100080,
北京,北京市海淀区,北京小天使美语幼儿园,幼儿园,,,西三环紫竹桥北洼路车道沟南里小区
北京,北京市海淀区,荆门供销幼儿园,幼儿园,0724-2333243,,荆门市金虾路102号联系
北京,北京市海淀区,北京市海淀区西北旺小学,幼儿园,6289905,100094,北京市海淀区西北旺路106号
北京,北京市海淀区,六郎庄幼儿园,幼儿园,62649705,,海淀乡六郎庄园子里25号
北京,北京市海淀区,亮甲店小学,幼儿园,,100036,北京市海淀区八里庄街道亮甲店1号
北京,北京市海淀区,四季青乡育红幼儿园,幼儿园,010-68152796,100039,
北京,北京市海淀区,南京市回民幼儿园,幼儿园,025-86653925,,建邺区茶南仁园内
北京,北京市海淀区,湘潭市直机关第二幼儿园,幼儿园,0732-8261071,,湖南省湘潭市雨湖区广新巷28号
北京,北京市海淀区,海淀区 海军第三幼儿园,幼儿园,010-66954031,,西三环中路19号海军大院内
北京,北京市海淀区,海淀区空直蓝天幼儿园,幼儿园,010-66984451,,北京市海淀区复兴路14号
北京,北京市海淀区,海淀区中国兵器工业机关服务中心幼儿园,幼儿园,010-68962456,,北京市车道沟10号院
北京,北京市海淀区,海淀区北京岭南幼儿园,幼儿园,010-88140034 88149546,,北京市海淀区定慧寺定慧东里34号
北京,北京市海淀区,海淀区北京市六一幼儿园,幼儿园,62883140,,北京市海淀区青龙桥
北京,北京市海淀区,绍兴诸暨市浣江幼儿园,幼儿园,0575-7111077,,浣沙北路32号
北京,北京市海淀区,镇江贺家弄幼儿园,幼儿园,4422944,,贺家弄村
北京,北京市海淀区,东府幼儿园,幼儿园,0288665,,
北京,北京市海淀区,幸福泉 幼儿园,幼儿园,010-84961463 8496146,,朝阳区北苑家园绣菊园2号
北京,北京市海淀区,幸福泉天使幼儿园,幼儿园,010-64154181 6417072,,朝阳区幸福二村29号楼
北京,北京市海淀区,国家旅游局幼儿园,幼儿园,6466867,,朝阳区静安东里6号楼园长:李良红
北京,北京市海淀区,农业部幼儿园,幼儿园,6507552,,农展南里11号园长:吴珊
北京,北京市海淀区,朝阳区团结湖第一幼儿园,幼儿园,6425169,,朝阳区安华里园长:郭文英
北京,北京市海淀区,鲍家街幼儿园,幼儿园,010-66022312,,复兴门内大街前老来街38号园长:张淑兰
北京,北京市海淀区,外经贸部机关幼儿园,幼儿园,6524621,,崇文区台基石三条2号园长:宋小茹
北京,北京市海淀区,北京军区空军宇锋幼儿园,幼儿园,6618991,,西城区群力胡同17号园长:黄兴仪
北京,北京市海淀区,公安部幼儿园,幼儿园,010-63261827,,木樨地北里2号园长:张秀珍
北京,北京市海淀区,北海幼儿园,幼儿园,6404274 5640704,,地安门西大街22号园长:卢姗姗
北京,北京市海淀区,北京市第六幼儿园,幼儿园,6404422,,西城区旧鼓楼大街43号园长:李建丽
北京,北京市海淀区,冶金工业部幼儿园,幼儿园,6421277,,安定门外地兴居47号园长:赵玉华
北京,北京市海淀区,北京市宣武区三教寺幼儿园,幼儿园,6352779,,宣武区白纸坊东街6号园长:尹会美
北京,北京市海淀区,装甲兵工程学院幼儿园,幼儿园,6671747,,丰台区装甲兵工程学院崔村19号院园长:王季青
北京,北京市海淀区,北京市昌平区机关幼儿园,幼儿园,010-69741046,,鼓楼南大街永安巷5号园长:刘淑新
北京,北京市海淀区,北京明天幼稚集团第五幼儿园,幼儿园,010-62543244,,
北京,北京市海淀区,中国人民解放军总医院幼儿园,幼儿园,6693730,,海淀区复兴路28号园长:葛蓓莉
北京,北京市海淀区,北京明天幼稚集团第二幼儿园,幼儿园,010-62550349,,
北京,北京市海淀区,北京明天幼稚集团第一幼儿园,幼儿园,010-62015251,,
北京,北京市海淀区,北京市东城区职业教育中心学校附属幼儿园,幼儿园,6416192,,
北京,北京市海淀区,中国人民解放军国防大学第一幼儿园,幼儿园,6676429,,
北京,北京市海淀区,北京军区司令部幼儿园,幼儿园,6637954,,八大处甲1号园长:孙双池
北京,北京市海淀区,北京市宣武区槐柏树幼儿园,幼儿园,6302110 100053,,槐柏树南里10号楼
北京,北京市海淀区,航天部第一研究院幼儿园,幼儿园,6838186,,丰台区万源路东高地90栋园长:张琳
北京,北京市海淀区,北京市延庆县新城幼儿园,幼儿园,010-69142291,,延庆县新城街5号园长:支秀风
北京,北京市海淀区,中央音乐学院中和音乐艺术幼儿园,幼儿园,0106245 6569624 62854,,北京市海淀区黑龙潭中央音乐学院教学基地
北京,北京市海淀区,中国人民解放军总后勤部六一幼儿园,幼儿园,6688441 6688803,,丰台北大地75号院内园长:薛春霞
北京,北京市海淀区,中国航天工业总公司第三研究院幼儿园,幼儿园,6837543,,丰台区云港北里18号园长:徐艳
北京,北京市海淀区,解放军总参炮兵幼儿园,幼儿园,6682794,,海淀区复兴路24号园长:郑紫云
北京,北京市海淀区,航天机关幼儿园,幼儿园,6837240 9683716,,海淀区阜成路8号园长:李秀英
北京,北京市海淀区,兵器工业总公司车道沟幼儿园,幼儿园,6896245,,海淀区车道沟10号院园长:闫慧
北京,北京市海淀区,中国科学院第一幼儿园,幼儿园,6255362,,中关村24楼旁一幼园长:郭美仙
北京,北京市海淀区,国务院机关事务管理局幼儿园,幼儿园,6842016 2684298,,海淀区增光路5号园长:陈文萍
北京,北京市海淀区,中国科学院第硒幼儿园,幼儿园,6255220,,中关村南一街2号园长:李树荣
北京,北京市海淀区,金牛子幼稚园,幼儿园,6071382 6729368,102200,昌平莽山森林公园以东1.5公里，昌平县十三陵水库路华蓄水电培训中心
北京,北京市海淀区,中国人民解放军总后勤部五一幼儿园,幼儿园,6688734 6688544,,太平路31号园长:关俊英
北京,北京市海淀区,中国人民解放军海军直属机关第二幼儿园,幼儿园,6695402 1669540,,
北京,北京市海淀区,中国人民解放军军事科学院幼儿园,幼儿园,6676725,,海淀区镶红旗园长:杨毅
北京,北京市海淀区,北京师范大学实验幼儿园,幼儿园,6220812,,新外大街19号北师大院内园长:张澜
北京,北京市海淀区,水利局幼儿园,幼儿园,6851483,,玉渊潭公园内园长:陈风云
北京,北京市怀柔区,同铁路分局大秦铁路公司茶坞幼儿园,幼儿园,,101402,北京市怀柔县桥梓
北京,北京市怀柔区,北京市怀柔县第二幼儿园,幼儿园,010-69622792,,湖光滤我15号园长:梅永勤
北京,北京市怀柔区,北京怀柔爱心幼儿园,幼儿园,6166778,,北京市怀柔区雁栖镇乐园庄
北京,北京市怀柔区,北京市怀柔县工业局幼儿园,幼儿园,,101400,北京市怀柔县商业街26号
北京,北京市怀柔区,宝山寺中心幼儿园,幼儿园,,101411,北京市怀柔县宝山寺
北京,北京市怀柔区,怀柔县第一幼儿园,幼儿园,,101400,北京市怀柔县新街
北京,北京市密云县,密云县工业局幼儿园,幼儿园,,101500,北京市密云县鼓楼东大街47号
北京,北京市密云县,密云县卫生局幼儿园,幼儿园,,101500,北京市密云县西鱼市口
北京,北京市密云县,密云县供销合作社联合社幼儿园,幼儿园,,101500,北京市密云县马连胡同
北京,北京市密云县,农机局幼儿园,幼儿园,,101500,北京市密云县玉皇庙
北京,北京市密云县,密云县机关幼儿园,幼儿园,,101500,北京市密云县东大街
北京,北京市平谷区,平谷区第五幼儿园,幼儿园,6995601,101200,北京市平谷区兴谷园小区甲５号
北京,北京市平谷区,平谷县欣芽幼儿园,幼儿园,,101200,北京市平谷县建设南街
北京,北京市平谷区,北京市平谷县第三幼儿园,幼儿园,,101200,北京市平谷县滨河
北京,北京市平谷区,平谷县第四幼儿园,幼儿园,,101200,北京市平谷县金乡小区42号
北京,北京市平谷区,平谷县第二幼儿园,幼儿园,,101200,北京市平谷县幸福小区12号
北京,北京市平谷区,平谷县幼儿园,幼儿园,,101200,北京市平谷县幸福小区13号
北京,北京市石景山区,地铁古城车辆幼儿园,幼儿园,6887339,,石景山区杨庄地铁
北京,北京市石景山区,石景山发电厂幼儿园,幼儿园,8891115,,石景山区广宁村
北京,北京市石景山区,北京市石景山区古城街道幼儿园,幼儿园,,100043,北京市石景山区古城
北京,北京市石景山区,北京市石景山区古城地区民族幼儿园,幼儿园,,100043,北京市石景山区古城西路
北京,北京市石景山区,北方工业大学幼儿园,幼儿园,,100041,北京市石景山区西黄村
北京,北京市石景山区,北京市石景山区第二幼儿园,幼儿园,,100043,北京市石景山区八角南路东街
北京,北京市石景山区,北京市石景山区幼儿师范学校,幼儿园,,100041,北京市石景山区苹果园七区
北京,北京市石景山区,北京市石景山区师范附属幼儿园,幼儿园,,100039,北京市石景山区永乐小区
北京,北京市石景山区,北京市石景山区幼儿园,幼儿园,,100043,北京市石景山区古城南里
北京,北京市石景山区,石景山区石景山第三幼儿园,幼儿园,010-88792445,,八大处高科技发展园区
北京,北京市石景山区,石景山区北京军区政治部幼儿园,幼儿园,66399547,,北京市石景山区八大处甲1号军区政治部幼儿园
北京,北京市石景山区,石景山区石景山实验幼儿园,幼儿园,010-68874902,,石景山区古城南里
北京,北京市石景山区,首钢六幼,幼儿园,6887287,,石景山区苹果园四区
北京,北京市顺义区,顺义县南彩镇中心幼儿园,幼儿园,,101300,北京市顺义县南彩
北京,北京市顺义区,李遂镇中心幼儿园,幼儿园,,,北京市 北京市区 顺义区 : 顺义区李遂镇
北京,北京市顺义区,顺义县大孙各庄镇中心幼儿园,幼儿园,,101308,北京市顺义县大孙各庄
北京,北京市顺义区,北京市顺义区仁和幼儿园,幼儿园,8944606,,
北京,北京市顺义区,顺义区幸福幼儿园,幼儿园,0106942,,
北京,北京市顺义区,高丽营镇中心幼儿园,幼儿园,,101303,北京市顺义县四村
北京,北京市顺义区,顺义县尹家府中心幼儿园,幼儿园,,101308,北京市顺义县四福庄
北京,北京市顺义区,顺义县义宾幼儿园,幼儿园,,101300,北京市顺义县义宾
北京,北京市顺义区,顺义县牛山镇中心幼儿园,幼儿园,,101301,北京市顺义县安乐
北京,北京市顺义区,北京市顺义县北小营乡中心幼儿园,幼儿园,,101305,北京市顺义县北小营
北京,北京市顺义区,木林中心幼儿园,幼儿园,,101300,北京市顺义县木林
北京,北京市顺义区,北京顺义县付食品公司幼儿园,幼儿园,,101300,北京市顺义县光明北
北京,北京市顺义区,顺义县华夏公贸集团公司幼儿园,幼儿园,,101300,北京市顺义县幸福街
北京,北京市顺义区,顺义县滨河幼儿园,幼儿园,,101300,北京市顺义县潮白新村
北京,北京市顺义区,顺义县供销合作社幼儿园,幼儿园,,101300,北京市顺义县幸福西街
北京,北京市顺义区,顺义县杨镇中心幼儿园,幼儿园,,101309,北京市顺义县二街
北京,北京市顺义区,顺义县第五幼儿园,幼儿园,,101300,北京市顺义县石园
北京,北京市顺义区,顺义县西辛幼儿园,幼儿园,,101300,北京市顺义县西辛小区
北京,北京市顺义区,顺义县建新幼儿园,幼儿园,,101300,北京市顺义县建北
北京,北京市顺义区,顺义县幼儿教育培训中心,幼儿园,,101300,北京市顺义县建南
北京,北京市顺义区,顺义县第三幼儿园,幼儿园,,101300,北京市顺义县建南
北京,北京市顺义区,顺义县天竺中心幼儿园,幼儿园,,101312,北京市顺义县天竺
北京,北京市通州区,通州区街道中心幼儿园,幼儿园,6954136 0806015,,北京市通州区如意园甲12号楼
北京,北京市通州区,汇佳儿童馆,幼儿园,8950554,,
北京,北京市通州区,通州区东方幼儿园,幼儿园,6954114,,通州区玉带河大街141号东方生活区院内
北京,北京市通州区,通州区如意中心幼儿园,幼儿园,010-69558733 69541360,,北京市通州区
北京,北京市通州区,通州区新苗幼儿园,幼儿园,010-89558599 6954989,,新建园:北京市通州区新建小区5号楼；潞苑园:通州区靶场路潞苑嘉园小区27号楼
北京,北京市通州区,通州区天使宝贝双语艺术幼儿园,幼儿园,010-80855171 010-80855170,,北京市通州区通胡大街25号河畔丽景小区内
北京,北京市西城区,西四北幼儿园,幼儿园,6618154,,
北京,北京市西城区,北京西城回民幼儿园,幼儿园,8208237,,新明胡同乙1号
北京,北京市西城区,西城区新京畿道幼儿园,幼儿园,6602204,,二龙路京畿道12号
北京,北京市西城区,月坛第一幼儿园,幼儿园,6852742,,三里河北街23号
北京,北京市西城区,北新华街幼儿园,幼儿园,6605478,100031,北京市北京市辖区西城区东安福胡同35号
北京,北京市西城区,府右街幼儿园,幼儿园,6602107,100032,府右街21号
北京,北京市西城区,大拐棒幼儿园,幼儿园,6617647,100034,大拐棒胡同15号
北京,北京市西城区,西四北三条幼儿园,幼儿园,6611370,100034,西四北三条19号
北京,北京市西城区,察院幼儿园,幼儿园,6602085,,察院胡同40号
北京,北京市西城区,横三条幼儿园,幼儿园,6616122,100034,宫门口横胡同8号
北京,北京市西城区,车公庄幼儿园,幼儿园,6835452,,车公庄北里一区14楼
北京,北京市西城区,月坛二幼,幼儿园,6801517,,真武庙三里4号楼中门1号
北京,北京市西城区,月坛四幼,幼儿园,6802690,,南礼士路46号
