省份,地区,学校名称,类型,电话,邮编,地址
北京,北京市,北京市朝阳区松榆东里幼儿园,幼儿园,010-67343168,100021,北京市朝阳区松榆东里３０号楼
北京,北京市,北京市朝阳区潘家园街道中心幼儿园,幼儿园,010-67310689,100021,北京市朝阳区松榆里３４号楼南
北京,北京市,北京市朝阳区花家地北里幼儿园,幼儿园,010-64736605,100102,北京市朝阳区花家地北里
北京,北京市,北京市朝阳区西坝河第一幼儿园望京新城幼儿园,幼儿园,010-64749563,100102,朝阳区望京新城西园四区４０９楼
北京,北京市,北京市朝阳区青苗幼儿园,幼儿园,010-64664803,100016,北京市朝阳区亮马桥４０号
北京,北京市,北京市朝阳区香河园街道中心幼儿园,幼儿园,010-64650687,100028,北京市朝阳区柳芳北里7号楼
北京,北京市,北京市未来之星实验幼儿园,幼儿园,010-62328803,100083,北京市海淀区学院路14号新区
北京,北京市,北京市桃李幼儿园,幼儿园,010-69686902,101400,北京市怀柔县迎宾中路6号
北京,北京市,北京市水利局幼儿园,幼儿园,010-68529877,100038,北京市海淀区玉渊潭公园内
北京,北京市,北京市海淀区万寿路街道翠微幼儿园,幼儿园,010-68225928,100036,北京市海淀区翠微南里２２号
北京,北京市,北京市海淀区世纪汇佳幼儿园,幼儿园,10-88595252,100089,北京市海淀区四季青昆明湖南路６２号
北京,北京市,北京市海淀区中关村街道第一幼儿园,幼儿园,010-62531629,100080,北京市海淀区中关村北区甲13楼
北京,北京市,北京市海淀区人民政府机关幼儿园,幼儿园,010-62551521,100080,北京市海淀区知春东里14号楼
北京,北京市,北京市海淀区北太平庄育新幼儿园,幼儿园,010-62250374,100088,北京市海淀区文慧园北路甲6号5号楼
北京,北京市,北京市海淀区博雅双语艺术幼儿园,幼儿园,10-88571503,100081,北京市海淀区魏公村街１号韦伯豪家园１０号
北京,北京市,北京市海淀区四季青乡南平庄幼儿园,幼儿园,010-88441226,100089,北京市海淀区四季青乡南平庄122号
北京,北京市,北京市海淀区四季青乡常青幼儿园,幼儿园,010-88448140,100089,北京市海淀区四季青东冉村443号
北京,北京市,北京市海淀区妇联直属海南幼儿园,幼儿园,010-62645810,100080,北京市海淀区海淀南路7号
北京,北京市,北京市海淀区学院路街道展春园幼儿园,幼儿园,010-62321510,100083,北京市海淀区展春园小区20号
北京,北京市,北京市海淀区小星星双语艺术幼儿园,幼儿园,010-62896558,100094,北京市海淀区马连洼梅园小区
北京,北京市,北京市海淀区恩济里幼儿园,幼儿园,010-88132486,100036,北京市海淀区恩济里小区10号
北京,北京市,北京市海淀区本真技术幼儿园,幼儿园,010-62316639,100083,北京市海淀区二里庄小区内
北京,北京市,北京市海淀区海淀乡中心幼儿园,幼儿园,010-62649705,100080,北京市海淀区六郎庄
北京,北京市,北京市海淀区海淀街道厂洼幼儿园,幼儿园,010-68417268,100081,北京市海淀区厂洼小区５号楼西侧
北京,北京市,北京市海淀区玉渊潭中心幼儿园,幼儿园,010-88115407,100036,北京市海淀区八里庄174号
北京,北京市,北京市海淀区羊坊店第一幼儿园,幼儿园,010-63965605,100038,北京市海淀区铁道部宿舍１０３栋
北京,北京市,北京市海淀区群芳培训学校,幼儿园,010-62578061,100094,北京市海淀区永丰屯佃
北京,北京市,北京市海淀区翠湖幼儿园,幼儿园,010-62471402,100094,北京市海淀区上庄乡
北京,北京市,北京市海淀区英才幼儿园,幼儿园,010-62324145,100083,北京市海淀区北四环中路志新村小区12号
北京,北京市,北京市海淀区西山农场幼儿园,幼儿园,010-62465780,100095,北京市海淀区聂各庄台头
北京,北京市,北京市清华洁华幼儿园,幼儿园,010-62782354,100084,北京市海淀区清华大学校内
北京,北京市,北京市燕山少年宫,幼儿园,010-69341241,102500,北京市房山区燕山迎风四里
北京,北京市,北京市燕山幼儿园,幼儿园,010-69341889,102500,北京市房山区燕山杏花西里３２号
北京,北京市,北京市爱心幼儿园,幼儿园,010-89791254,102202,北京市昌平区南口南大街道21号
北京,北京市,北京市王府井大街幼儿园,幼儿园,010-65255723,100006,北京市东城区大勃鸽胡同14号
北京,北京市,北京市电信管理局行政处陶然幼儿园,幼儿园,010-63559086,100052,北京市宣武区黑窑厂西里甲11号
北京,北京市,北京市皇城双语幼稚园,幼儿园,010-66181525,100009,北京市西城区柳荫街甲10号
北京,北京市,北京市石景山区八角北路幼儿园,幼儿园,010-68876355,100043,北京市石景山区八角北路
北京,北京市,北京市石景山区八角幼儿园,幼儿园,010-68874744,100043,北京市石景山区八角南路１４栋楼东侧
北京,北京市,北京市石景山区师范学校附属幼儿园,幼儿园,010-68652877,100039,北京市石景山区永乐东小区
北京,北京市,北京市石景山区民办北方之星幼儿园,幼儿园,010-68687989,100040,北京市石景山区鲁谷西街
北京,北京市,北京市石景山区民办新世纪幼儿园,幼儿园,010-68626456,100040,北京市石景山区八宝山街道六合园八区八号
北京,北京市,北京市石景山区第三幼儿园,幼儿园,010-68872445,100041,北京市石景山区苹果园海特花园幼儿园
北京,北京市,北京市石景山区金顶街街道二北居委会回民托儿所,幼儿园,010-68807289,100041,北京市石景山区金顶街二区
北京,北京市,北京市石景山区金顶街街道办事处幼儿园,幼儿园,010-88732055,100041,北京市石景山区金顶街
北京,北京市,北京市石景山区金顶街街道四区北托儿所,幼儿园,010-68866772,100041,北京市石景山区金顶街四区北
北京,北京市,北京市第一幼儿园附属实验园,幼儿园,010-84275712,100013,北京市东城区安外小黄庄小区南门７号楼
北京,北京市,北京市育龙幼儿园,幼儿园,010-62345848,100083,北京市海淀区东王庄小区7号楼
北京,北京市,北京市蓓蕾幼儿园,幼儿园,010-85825292,100025,北京市朝阳区十里堡壁板厂1号
北京,北京市,北京市蓝天北潞幼儿园,幼儿园,010-89391345,102488,北京市房山区良乡北潞园居住区内
北京,北京市,北京市西城区二龙路察院幼儿园,幼儿园,010-66020859,100031,北京市西城区察院胡同40号
北京,北京市,北京市西城区月坛街道办事处第一幼儿园,幼儿园,010-68527429,100045,北京市西城区三里河北街２３号
北京,北京市,北京市西城区月坛街道办事处第四幼儿园,幼儿园,010-68026906,100045,北京市西城区南礼士路４６号
北京,北京市,北京市西城区福绥境横三条幼儿园,幼儿园,010-66161227,100034,北京市西城区宫门口横胡同8号
北京,北京市,北京市西城区福绥境街道北魏幼儿园,幼儿园,010-66161266,100034,西城区福绥境北魏胡同４０号
北京,北京市,北京市西城区西四北幼儿园,幼儿园,010-66182447,100034,北京市西城区西四北三条11号
北京,北京市,北京市西城区金字塔儿童潜能培训学校,幼儿园,010-68054268,100045,北京市西城区月坛西街东里１６号楼
北京,北京市,北京市西城区阜外街道北营幼儿园,幼儿园,010-68358449,100037,北京市西城区北营房西里
北京,北京市,北京市西草市幼儿园,幼儿园,010-67022454,100050,北京市崇文区西草市东街60号
北京,北京市,北京市西郊粮食仓库迪育幼儿园,幼儿园,010-68186663,100039,北京市海淀区田村路41号
北京,北京市,北京市通州区幼儿园,幼儿园,010-69544030,101100,北京市通州区中山街１０３号
北京,北京市,北京市通州区教工幼儿园,幼儿园,010-69544818,101100,北京市通州区后南仓甲35号
北京,北京市,北京市通州区新城东里幼儿园,幼儿园,010-69545284,101100,北京市通州区新城东里2号楼
北京,北京市,北京市通州区梨园地区中心幼儿园,幼儿园,010-60521452,101101,北京市通州区梨园魏家坟
北京,北京市,北京市通州区民族幼儿园,幼儿园,010-69542233,101100,北京市通州区靳家胡同３号
北京,北京市,北京市通州区永顺镇中心幼儿园,幼儿园,010-69551672,101100,北京市通州区永顺新建
北京,北京市,北京市通州区瀚林华馨幼儿园,幼儿园,10-69505829,101111,北京市通州区台湖镇次渠大街１９号
北京,北京市,北京市通州区马驹桥镇中心幼儿园,幼儿园,010-60508947,101102,北京市通州区马驹桥西店
北京,北京市,北京市金牛幼儿园,幼儿园,010-81787075,102209,北京市昌平区北七家平西府
北京,北京市,北京市门头沟区东辛房幼儿园,幼儿园,010-69842866,102300,北京市门头沟区东辛房北后街３０号
北京,北京市,北京市门头沟区东辛房幼儿园培训部,幼儿园,010-69842866,102300,北京市门头沟区东辛房北后街３０号
北京,北京市,北京市门头沟区城子幼儿园,幼儿园,010-69842266 010-69866416,102300,北京市门头沟区城子中街16号
北京,北京市,北京市门头沟区幼儿园,幼儿园,010-69843196,102300,北京市门头沟区新桥大街４４号
北京,北京市,北京市门头沟区幼儿园艺术培训部,幼儿园,010-69843196,102300,北京市门头沟区新桥大街４４号
北京,北京市,北京市门头沟区新世纪幼儿园,幼儿园,10-61866939,102300,北京市门头沟区滨河居住区
北京,北京市,北京市顺义区万科城市花园幼儿园,幼儿园,010-80497699,101300,北京市顺义区天竺空港开发区B区裕民大街
北京,北京市,北京市顺义区仁和中心幼儿园,幼儿园,010-89449587,101300,北京市顺义区石园南区
北京,北京市,北京市顺义区北小营中心幼儿园,幼儿园,010-60483603,101305,北京市顺义区北小营镇
北京,北京市,北京市顺义区木林中心幼儿园,幼儿园,010-60456082,101314,北京市顺义区木林镇顺焦路木林段83号
北京,北京市,北京市顺义区采风幼儿园,幼儿园,10-89477510,101300,北京市顺义区南彩镇前俸伯村
北京,北京市,北京怀柔精诚文化学校,幼儿园,010-69659964,101400,北京市怀柔县迎宾北路7号
北京,北京市,北京旅行车有限公司幼儿园,幼儿园,010-67563275,100075,北京市丰台区大红门西路26号
北京,北京市,北京明天幼稚集团八幼,幼儿园,010-62986743,100085,北京市海淀区上地东一区
北京,北京市,北京明天幼稚集团第三幼儿园,幼儿园,010-62250293,100088,北京市海淀区新外大街小西志强园小区内
北京,北京市,北京明天幼稚集团第六幼儿园,幼儿园,010-68224231,100039,北京市海淀区玉海园五里21号
北京,北京市,北京明天幼雅集团,幼儿园,010-62015253,100083,北京市海淀区迎春园甲7号
北京,北京市,北京明日之星儿童教育服务中心,幼儿园,010-62325036,100083,北京市海淀区二里庄小区6号楼2门502号
北京,北京市,北京有色金属研究总院幼儿园,幼儿园,010-62014488-4027,100088,北京市海淀区新街口外大街３号
北京,北京市,北京朝阳明昊装饰装璜有限责任公司,幼儿园,010-67705652,100022,北京市朝阳区南房化工路51号
北京,北京市,北京欣欣环文化传播有限公司,幼儿园,010-13671114,102604,北京市朝阳区朝阳门外朝外三条
北京,北京市,北京永泰幼儿园,幼儿园,010-62986743,100085,北京市海淀区西三旗永泰东里48号
北京,北京市,北京海淀区北太平庄街道红旗幼儿园,幼儿园,010-62241397,100088,北京市海淀区红联南村3号
北京,北京市,北京海淀区四季青乡北高庄幼儿园,幼儿园,010-88441013,100089,北京市海淀区四季青乡北高庄155号
北京,北京市,北京海淀区紫竹院街道第二幼儿园,幼儿园,010-68420674,100081,北京市海淀区魏公村小区16楼旁
北京,北京市,北京海淀区羊坊店第二幼儿园,幼儿园,010-68516709,100038,北京市海淀区茂林居6号
北京,北京市,北京燕服幼教中心,幼儿园,010-69343257,102500,北京市房山区向阳里一号
北京,北京市,北京理工后勤集团幼教中心,幼儿园,010-68913925,100081,北京市海淀区中关村南大街5号
北京,北京市,北京百联响羊业合作社,幼儿园,010-61432031,101308,北京市顺义区大孙各庄小段
北京,北京市,北京盘中餐科技中心有限责任公司,幼儿园,010-61431209,101308,北京市顺义区大孙各庄
北京,北京市,北京祥普实业公司幼儿园,幼儿园,010-62311593/62314475,100083,北京市海淀区学院路18号
北京,北京市,北京第九研究所九一幼儿园,幼儿园,010-62014411,100083,北京市海淀区花园路1号
北京,北京市,北京米加勒科技有限公司,幼儿园,010-88445492,100089,北京市海淀区清华大学华业大2513室
北京,北京市,北京红黄蓝儿童潜能教育娱乐有限公司,幼儿园,010-87684087,100078,北京市丰台区方庄芳古园一区28楼通润商务会馆
北京,北京市,北京育新实验幼儿园,幼儿园,010-82906303,100096,北京市海淀区西三旗东育新院内
北京,北京市,北京航空航天大学幼儿园,幼儿园,010-82317163,100083,北京市海淀区学院路37号
北京,北京市,北京蒙台梭利国际幼儿园,幼儿园,010-65326713,100027,北京市朝阳区三里屯北小街７号
北京,北京市,北京通州张家湾镇中心幼儿园,幼儿园,010-69573184,101113,北京市通州区张家湾南许场
北京,北京市,北京金色摇篮潜能开发婴幼园,幼儿园,010-64965391,100029,北京市朝阳区小关北里210号
北京,北京市,北京金苹果幼儿园,幼儿园,010-68815812,100041,北京市石景山区苹果园路16号
北京,北京市,北京金鸡响禽业产供销合作社,幼儿园,010-61432031,101308,北京市顺义区大孙各庄
北京,北京市,北京铁路局生活管理中心第一幼儿园,幼儿园,010-51822561,100038,北京市海淀区羊坊店双贝子坟3号
北京,北京市,北京阳光儿童早教实验中心,幼儿园,010-68257949,100036,北京市海淀区翠微北里10号
北京,北京市,北京飞达航空商贸服务中心,幼儿园,010-65014004,100103,北京市朝阳区团结湖街道白家庄家委会
北京,北京市,北京首创轮胎有限责任公司幼儿园,幼儿园,010-82925113,100096,北京市海淀区西三旗东路
北京,北京市,北京骇海淀区香山幼儿园,幼儿园,010-62590475,100093,北京市海淀区四季青乡香山四王府
北京,北京市,古城地区民族幼儿园,幼儿园,010-68872073,100043,北京市石景山区古城西路
北京,北京市,国内贸易部三里河幼儿园,幼儿园,010-68522532,100045,北京市西城区三里河二区11号
北京,北京市,国务院机关事务管理局花园村幼儿园,幼儿园,010-68421062,100037,北京市海淀区增光路51号
北京,北京市,国家煤炭工业局机关幼儿园,幼儿园,010-64463820,100013,北京市东城区和平里九区甲3号
北京,北京市,国家计划委员会幼儿园,幼儿园,010-68501970,100045,北京市西城区三里河一区40门
北京,北京市,国花幼儿园,幼儿园,010-62896758,100091,北京市海淀区肖家河桥东65号
北京,北京市,国营北京市双桥农场管庄双桥幼儿园,幼儿园,010-65898341,100024,北京市朝阳区管庄咸宁侯
北京,北京市,外交部机关及脏驻处机构服务中心东幼儿园,幼儿园,010-65023412,100020,北京市朝阳区光华西里2号
北京,北京市,大同铁路生活服务中心茶坞幼儿园,幼儿园,010-7123456,101402,北京市怀柔县茶坞铁路地区
北京,北京市,东华门缎库幼儿园,幼儿园,010-65252075,100006,北京市东城区南池子大街缎库胡同18号
北京,北京市,中共中央对外联络部幼儿园,幼儿园,010-83908352,100860,北京市海淀区复兴路4号
北京,北京市,中共中央直属机关事物管理局实验幼儿园,幼儿园,010-66173289,100032,北京市西城区宏庙胡同5号
北京,北京市,中国兵器工业机关服务中心幼儿园,幼儿园,010-68962456,100089,北京市海淀区车道沟十号院
北京,北京市,北医幼儿园,幼儿园,010-62091332,100083,北京市海淀区学院路38号
北京,北京市昌平区,北郊农场幼儿园,幼儿园,010-81792288,102208,北京市昌平区回龙观北郊农场
北京,北京市昌平区,北京市华龙苑物业管理中心幼儿园,幼儿园,010-69791794,,北京市昌平区霍营村西
北京,北京市昌平区,北京市心梦乐园,幼儿园,6271587,,北京市回龙观万润家园北门13号楼1单元202室
北京,北京市昌平区,万花筒幼儿园,幼儿园,8175932 8175932 139102122...,,天通苑北三区内万花筒幼儿园
北京,北京市昌平区,北京市昌平区教工幼儿园,幼儿园,010-89782027,,北京市昌平区西环里小区
北京,北京市昌平区,昌平汇佳幼儿园,幼儿园,010-81737133,,北京市昌平区回龙观文化居住区流星花园一区
北京,北京市昌平区,北京市昌平区工业幼儿园,幼儿园,010-69742271,,城区镇西环路园长:冯春芳
北京,北京市朝阳区,北京冠华世纪科技发展有限公司,幼儿园,010-84806599,,
北京,北京市朝阳区,北京生物制品研究所幼儿园,幼儿园,010-65762911,,北京市朝阳区三间房南里4号院内
北京,北京市朝阳区,北京有机化工厂幼儿园,幼儿园,6771225,,朝阳区化工路北京有机化工厂幼儿园
北京,北京市朝阳区,北人实业公司幼儿园,幼儿园,010-67737711,,朝阳区东三环南路48号
北京,北京市朝阳区,北京炼焦化学厂幼儿园,幼儿园,010-67383866,,朝阳区化工路东口
北京,北京市朝阳区,解放军总装备部后勤部幼儿园,幼儿园,010-66355523,,朝阳区德外安翔北里10号院
北京,北京市朝阳区,船舶七院幼儿园,幼儿园,010-64872211,,北京市朝阳区德外双泉堡甲2号
北京,北京市朝阳区,北京市长空机械公司幼儿园,幼儿园,010-64886312,,北京市朝阳区德胜门外苇子坑安翔里
北京,北京市朝阳区,外交部东郊幼儿园,幼儿园,010-65023412,,北京市朝阳区光华西里2号
北京,北京市朝阳区,朝阳区政府机关幼儿园,幼儿园,010-65094953,,北京市朝阳区雅宝里十一号楼
北京,北京市朝阳区,北京市朝阳区松榆里幼儿园,幼儿园,6733991,,北京市朝阳区松榆里21号楼
北京,北京市朝阳区,北京市朝阳区群星幼儿园,幼儿园,010-64223248,,北京市西坝河西里12号
北京,北京市朝阳区,北京市朝阳区新源里幼儿园,幼儿园,010-64674716,,北京市朝阳区新源里12楼
北京,北京市朝阳区,安贞里第一幼儿园,幼儿园,010-64411019,,
北京,北京市朝阳区,北京市朝阳区京通幼儿园,幼儿园,010-65700439,,北京市朝阳区京通新城38楼
北京,北京市朝阳区,北京市朝阳区花家地幼儿园,幼儿园,010-64730729,,北京市朝阳区花家地一区11楼
北京,北京市朝阳区,京市朝阳区新源里第二幼儿园,幼儿园,0106467,,北京市朝阳区三元里北小街7号
北京,北京市朝阳区,北京市朝阳区西坝河第三幼儿园,幼儿园,010-64678598,,北京市朝阳区西坝河中里20号
北京,北京市朝阳区,朝阳区垡头幼儿园,幼儿园,010-67383337,,北京市朝阳区垡头二区12号
北京,北京市朝阳区,北京市朝阳区秀园幼儿园,幼儿园,0106491,,北京市朝阳区安慧北里秀园19号楼
北京,北京市朝阳区,北京制浆造纸试验厂幼儿园,幼儿园,010-67721102,,北京市朝阳区制浆造纸试验厂
北京,北京市朝阳区,中国轻工业北京设计院幼儿园,幼儿园,010-65826261,,朝阳区白家庄东里2号院
北京,北京市朝阳区,北京市电机总厂幼儿园,幼儿园,010-64362131,,北京市朝阳区酒仙桥北路途7号
北京,北京市朝阳区,北京市第一市政工程公司幼儿园,幼儿园,010-64669309,,北京市朝阳区西坝河东里30号楼
北京,北京市朝阳区,十八里店乡华夏幼儿园,幼儿园,010-67330497,,北京市朝阳区十八里店乡周庄
北京,北京市朝阳区,十八里店乡东明幼儿园,幼儿园,010-67369515,,北京朝阳区十八里店乡西直河村
北京,北京市朝阳区,北京松下彩管有限公司幼儿园,幼儿园,6436335,,北京市朝阳区酒仙桥北路9号
北京,北京市朝阳区,63918部队幼儿园,幼儿园,6635853,,北京市朝阳区东直门外左家庄12号院
北京,北京市朝阳区,北京市朝阳区团结湖街道中心幼园,幼儿园,8598921,,北京市朝阳区团结湖水碓子东里26号楼
北京,北京市朝阳区,第三棉纺织厂幼儿园,幼儿园,010-65574049,,朝阳区朝外慈云寺
北京,北京市朝阳区,北京建材制品总厂幼儿园,幼儿园,010-85765544,,北京市朝阳区高井2号
北京,北京市朝阳区,北京京棉一厂幼儿园,幼儿园,010-65570059,,北京市朝阳区十里堡京棉一厂厂内
北京,北京市朝阳区,北京化工研究院幼儿园,幼儿园,010-64216131,,朝阳区和平街北口12区北京化工研究院
北京,北京市朝阳区,中国建筑科学研究院幼儿园,幼儿园,010-84272233,,北京市朝阳区北三环东路30号
北京,北京市朝阳区,总装备部直属机关幼儿园,幼儿园,010-66350278,,朝阳区安外黄寺大街九号幼儿园
北京,北京市朝阳区,北京市工商联安贞东里幼儿园,幼儿园,010-64415503,,北京市朝阳区安贞里2区9号楼
北京,北京市朝阳区,国家地震局地质研究所幼儿园,幼儿园,010-62009167,,北京市朝阳区德外祁家豁子
北京,北京市朝阳区,朝阳区小关街道对外经贸大学幼园,幼儿园,010-64492456,,北京市朝阳区安定门外惠新里东厂
北京,北京市朝阳区,信息产业部电子十二研究所幼儿园,幼儿园,010-64361731,,朝阳区酒仙桥芳园里十二所幼儿园
北京,北京市朝阳区,北京邮电通信设备厂幼儿园,幼儿园,010-64331487,,北京市朝阳区酒仙桥三街坊
北京,北京市朝阳区,勘测设计院幼儿园,幼儿园,010-65765533,,朝阳区定福庄西街1号
北京,北京市朝阳区,中建一局四公司幼儿园,幼儿园,010-64726644,,北京市朝阳区望花路西里13号楼
北京,北京市朝阳区,航空科研院幼儿园,幼儿园,010-64231166,,北京市朝阳区安外北苑2号院
北京,北京市朝阳区,朝阳区环境卫生管理局幼儿园,幼儿园,6552523,,朝阳区工体南路东草园5巷2号
北京,北京市朝阳区,北京市朝阳区建筑工程公司幼儿园,幼儿园,010-65021872,,朝阳区东大桥路13号
北京,北京市朝阳区,北京蓝岛大厦幼儿园,幼儿园,010-65062601,,北京市朝阳区呼家楼北街6号楼西侧
北京,北京市朝阳区,朝阳副食公司幼儿园,幼儿园,1101056 416644,,朝阳区北三里屯北14楼北侧
北京,北京市朝阳区,中国科学院第三幼儿园分园,幼儿园,010-62007461,,德胜门外华严里中科院苇子坑宿舍16号
北京,北京市朝阳区,煤炭科学研究总院幼儿园,幼儿园,010-84261952,,和平街十三区煤炭总院幼儿园
北京,北京市朝阳区,农业部机关幼儿园,幼儿园,0106507,,北京市朝阳区农展南里11号
北京,北京市朝阳区,北京市京棉二厂幼儿园,幼儿园,010-65570730,,北京市朝阳区东交八里庄1号
北京,北京市朝阳区,北京广播学院幼儿园,幼儿园,010-65779649,,定福庄南里七号
北京,北京市朝阳区,北京市卷烟厂幼儿园,幼儿园,010-65762922,,北京市卷烟厂幼儿园管庄西里42号
北京,北京市朝阳区,中国建材院幼儿园,幼儿园,010-65761331,,朝阳区管庄东里30号
北京,北京市朝阳区,朝阳区化工实验厂育欣幼儿园,幼儿园,0106779,,北京市朝阳区西大望路23号
北京,北京市朝阳区,朝阳区南磨房乡中心幼儿园,幼儿园,010-67314197,,北京市朝阳区平乐园小区210楼
北京,北京市朝阳区,北京市朝阳区小红门中心幼儿园,幼儿园,010-87601131,,北京市朝阳区小红门农贸市场
北京,北京市朝阳区,北京市朝阳区培新幼儿园,幼儿园,010-67633052,,北京市小红门乡龙爪树南里培新幼儿园
北京,北京市朝阳区,北京市王四营乡幼儿园,幼儿园,6736850,,北京市朝阳区王四营乡幼儿园
北京,北京市朝阳区,中国人民解放军63961部队幼儿园,幼儿园,010-66749641,,北京市安定门外北苑1号院幼儿园
北京,北京市朝阳区,人工晶体研究所幼儿园,幼儿园,010-65798711,,东坝红松园1号内人工晶体研究所幼儿园
北京,北京市朝阳区,来广营乡晨曦幼儿园,幼儿园,010-84912646,,北京市朝阳区来广营乡政府西侧
北京,北京市朝阳区,朝阳区安贞街道第四幼儿园,幼儿园,010-64248356,,北京市朝阳区安华西里二区二号楼
北京,北京市朝阳区,香河园街道西坝河东里幼儿园,幼儿园,010-64678696,,香河园街道西坝河东里第一托幼园所
北京,北京市朝阳区,香河园街道西坝河中里幼儿园,幼儿园,010-64651186,,香河园街道西坝河中里22号楼
北京,北京市朝阳区,北京市朝阳区六里屯街道中心幼园,幼儿园,010-65957662,,北京市朝阳区街道家园纺织小区甲4号
北京,北京市朝阳区,劲松街道雨禾儿园,幼儿园,010-67352090,,朝阳区农光东里10号楼
北京,北京市朝阳区,北京市朝阳区潘家园街道中心幼儿,幼儿园,010-67310689,,北京市朝阳区松榆西里34楼南
北京,北京市朝阳区,北京市朝阳区安贞街道中心幼儿园,幼儿园,0106441,,北京市朝阳区安贞西里二区18楼
